{
  "schema_version": "1.0",
  "status": "succeeded",
  "model_id": "topsis",
  "executor": "evaluation",
  "parameters": {},
  "input_summary": {"rows": 4, "columns": 3},
  "result": {"scores": [0.25, 0.75]},
  "diagnostics": {},
  "warnings": [],
  "reproducibility": {"seed": null, "deterministic": true}
}
